name,popularity
Doddapatre Tambuli Recipe (Karpooravalli Thayir Pachadi),"[<span id=""recipenumvotes"">15455 ratings.</span>]"
Fish Tandoori Recipe,"[<span id=""recipenumvotes"">2159 ratings.</span>]"
Arbi Shimla Mirch Sabzi Recipe – Colocasia Capsicum Sabzi,"[<span id=""recipenumvotes"">2427 ratings.</span>]"
Cabbage And Carrot Thoran Recipe,"[<span id=""recipenumvotes"">4879 ratings.</span>]"
Chicken Sholay Kebab Recipe,"[<span id=""recipenumvotes"">6919 ratings.</span>]"
Dim Posto Recipe - Bengali Egg Curry With Poppy Seeds,"[<span id=""recipenumvotes"">7756 ratings.</span>]"
Hyderabadi Shahi Mixed Vegetable Curry Recipe,"[<span id=""recipenumvotes"">7056 ratings.</span>]"
Kashmiri Kokur T Nadir Recipe-Chicken and Lotus Stem Curry,"[<span id=""recipenumvotes"">950 ratings.</span>]"
Punjabi Style Lobia Masala Recipe (Black Eyed Peas Masala),"[<span id=""recipenumvotes"">2410 ratings.</span>]"
Konkani Style Vali Bendi Recipe-Malabar Spinach Curry,"[<span id=""recipenumvotes"">2682 ratings.</span>]"
Cabbage & Buttermilk Curry Recipe,"[<span id=""recipenumvotes"">1495 ratings.</span>]"
Mulakootal Recipe (Vegetables In Coconut Gravy),"[<span id=""recipenumvotes"">1798 ratings.</span>]"
Karwar Style Valval Recipe (Mixed Vegetables In Coconut Milk),"[<span id=""recipenumvotes"">1588 ratings.</span>]"
Spicy Baby Potatoes Recipe,"[<span id=""recipenumvotes"">64532 ratings.</span>]"
Karnataka Style Beetroot Palya Recipe,"[<span id=""recipenumvotes"">13592 ratings.</span>]"
Whole Wheat Lachha Paratha Recipe-Multilayered Layered Indian Flat Bread,"[<span id=""recipenumvotes"">10327 ratings.</span>]"
Baked Amritsari Kulcha Recipe (Without Yeast),"[<span id=""recipenumvotes"">5813 ratings.</span>]"
Goan Style Mushroom Shagoti Recipe,"[<span id=""recipenumvotes"">2917 ratings.</span>]"
Amritsari Fish Gravy Recipe,"[<span id=""recipenumvotes"">13278 ratings.</span>]"
Udupi Style Ash Gourd Coconut Curry Recipe,"[<span id=""recipenumvotes"">18163 ratings.</span>]"
Goan Style Patol Bhaji Recipe- Green peas Curry Recipe,"[<span id=""recipenumvotes"">6127 ratings.</span>]"
Chettinad Sura Meen Kuzhambu Recipe (Shark Fish Curry),"[<span id=""recipenumvotes"">15049 ratings.</span>]"
Masala Vada Curry Recipe - Chana Dal Vada Curry Recipe,"[<span id=""recipenumvotes"">11054 ratings.</span>]"
Paneer Gassi Recipe,"[<span id=""recipenumvotes"">1927 ratings.</span>]"
Veg Mughlai Paratha Recipe,"[<span id=""recipenumvotes"">10377 ratings.</span>]"
Goan Style Mushroom Vindaloo Recipe,"[<span id=""recipenumvotes"">3950 ratings.</span>]"
Andhra Style Davva Aava koora Recipe (Sweet and Spicy Banana Stem Peanut Curry Recipe),"[<span id=""recipenumvotes"">2614 ratings.</span>]"
Chettinad Rasam Powder Recipe,"[<span id=""recipenumvotes"">5029 ratings.</span>]"
Bhaat Na Rasawala Muthia Dhokla Recipe | Gujarati Rasiya Dhokla,"[<span id=""recipenumvotes"">3267 ratings.</span>]"
Stuffed Mooli Paratha Recipe (Radish Flat Bread),"[<span id=""recipenumvotes"">4038 ratings.</span>]"
Paneer Tikka Pulao Recipe,"[<span id=""recipenumvotes"">3670 ratings.</span>]"
Chettinad Style Pepper Mushroom Recipe,"[<span id=""recipenumvotes"">7655 ratings.</span>]"
Roasted Eggplant And Chickpea Curry Flavored With Curry Leaves And Mustard Seeds,"[<span id=""recipenumvotes"">1085 ratings.</span>]"
Omakka Curry Recipe - Kerala Style Papaya Curry,"[<span id=""recipenumvotes"">7625 ratings.</span>]"
Urulaizhilangu Podimas (South Indian Style Potato Mash),"[<span id=""recipenumvotes"">985 ratings.</span>]"
Olya Kaju Chi Amti Recipe - Malvani Cashew Nut Curry,"[<span id=""recipenumvotes"">1994 ratings.</span>]"
Rajma Saagwala (Dry Kidney Beans And Spinach Stir Fry) Recipe,"[<span id=""recipenumvotes"">2425 ratings.</span>]"
Raw Banana and Banana Stem Stuffed Paratha Recipe,"[<span id=""recipenumvotes"">792 ratings.</span>]"
Chicken Kappa Biryani Recipe,"[<span id=""recipenumvotes"">3204 ratings.</span>]"
Kodava Kummu Curry Recipe- Coorg Style Mushroom Curry,"[<span id=""recipenumvotes"">4534 ratings.</span>]"
Stuffed Gilka Recipe (Maharashtrian Style Stuffed Silk Squash),"[<span id=""recipenumvotes"">1517 ratings.</span>]"
Dubki Wale Aloo Recipe - Potatoes In A Spicy North Indian Gravy,"[<span id=""recipenumvotes"">4762 ratings.</span>]"
Masaledar Moongphali Til Wale Aloo Recipe,"[<span id=""recipenumvotes"">1369 ratings.</span>]"
Lagan Ki Machli Recipe - Delicious Pomfret Curry,"[<span id=""recipenumvotes"">1987 ratings.</span>]"
Tamatar Wali Arbi Sabzi Recipe,"[<span id=""recipenumvotes"">1604 ratings.</span>]"
Goan Bimbla Uddamethi Recipe,"[<span id=""recipenumvotes"">1927 ratings.</span>]"
Chettinad Style Prawn Biryani Recipe,"[<span id=""recipenumvotes"">7826 ratings.</span>]"
Chicken Wings With Bhuna Masala Recipe,"[<span id=""recipenumvotes"">2108 ratings.</span>]"
Tripura Style Kosoi Bwtwi Recipe - Sauteed Tofu & Green Beans Stir Fry With Garlic,"[<span id=""recipenumvotes"">1226 ratings.</span>]"
Bell Pepper Sabji Recipe-No Onion No Garlic,700
Chettinad Keerai Mandi Recipe With Amaranth Greens,"[<span id=""recipenumvotes"">1754 ratings.</span>]"
Kashmir Style Bom Chount/Wangan Recipe-Spicy Apple Brinjal Curry,700
Mangalore Style Nurge Gashie Recipe-Spicy Drumstick Curry,700
Beerakaya Tomato Koora Recipe (Andhra Style Ridge Gourd Curry),"[<span id=""recipenumvotes"">6597 ratings.</span>]"
Mint Coriander Spice Pulao Recipe,"[<span id=""recipenumvotes"">1993 ratings.</span>]"
Kerala Style Vegetable Stew Recipe with Coconut Milk,700
Moolangi Tovve Recipe - Radish Curry,700
Rajasthani Dal Muthiya Recipe,"[<span id=""recipenumvotes"">1803 ratings.</span>]"
Bengaluru Style Brinjal Gravy Recipe - For Biryani,"[<span id=""recipenumvotes"">31558 ratings.</span>]"
Ridge Gourd Tambli Recipe - Spicy Ridge Gourd in Coconut Curry,"[<span id=""recipenumvotes"">1644 ratings.</span>]"
Dahi Methi Puri Recipe - Fenugreek Leaves Puri With Yogurt,"[<span id=""recipenumvotes"">6444 ratings.</span>]"
Coorg Style Kumbala Curry Recipe (Pumpkin Sabzi),"[<span id=""recipenumvotes"">2613 ratings.</span>]"
Paneer Jalfrezi Recipe,"[<span id=""recipenumvotes"">1734 ratings.</span>]"
Mangalorean Style Bendekayi Huli Koddel Recipe - Ladies finger Dal without Coconut Recipe,"[<span id=""recipenumvotes"">2144 ratings.</span>]"
Milagai Bajji Stuffed with Masala Chicken Recipe,"[<span id=""recipenumvotes"">1675 ratings.</span>]"
Mixed Vegetable Handi Recipe,"[<span id=""recipenumvotes"">4461 ratings.</span>]"
Pumpkin Curry With Chicken Recipe,"[<span id=""recipenumvotes"">3256 ratings.</span>]"
Goan Mushroom Xacuti Recipe,"[<span id=""recipenumvotes"">9252 ratings.</span>]"
Navrang Dal Recipe ( Spicy Mixed Lentils),"[<span id=""recipenumvotes"">4216 ratings.</span>]"
Chicken Keema Paratha Recipe - Minced Chicken Flat Bread,"[<span id=""recipenumvotes"">9663 ratings.</span>]"
Hariyali Egg Curry Recipe In Coriander and Mint Gravy,"[<span id=""recipenumvotes"">4494 ratings.</span>]"
Goan Sorak Curry Recipe,"[<span id=""recipenumvotes"">4221 ratings.</span>]"
Bendekayi Koddel/Bolu Huli Recipe - Mangalorean Style Bhindi Sambar Recipe,"[<span id=""recipenumvotes"">8213 ratings.</span>]"
Chenakayi Erissery Recipe - Yam Erissery,"[<span id=""recipenumvotes"">3408 ratings.</span>]"
Mint Vegetables Moilee Recipe (Mixed Vegetables Cooked In Minty Coconut Milk),"[<span id=""recipenumvotes"">1491 ratings.</span>]"
Andhra Style Munakkada Masala Kura Recipe - Drumstick Dry Curry Recipe,"[<span id=""recipenumvotes"">9110 ratings.</span>]"
Seppakizhangu Roast (South Indian Style Arbi Fry) Recipe,"[<span id=""recipenumvotes"">2141 ratings.</span>]"
Cauliflower Curry With Bell Peppers And Carrots In Spiced Milk Gravy,"[<span id=""recipenumvotes"">1571 ratings.</span>]"
Mangalorean Style Kuvalyacho Pollav Recipe (Yellow Pumpkin Curry Recipe),"[<span id=""recipenumvotes"">3991 ratings.</span>]"
Beetroot Greens Rice Recipe,"[<span id=""recipenumvotes"">1763 ratings.</span>]"
Moongachi Usali (Goan Style Sprouted Green Gram Stir Fry),"[<span id=""recipenumvotes"">1465 ratings.</span>]"
Pumpkin Chapati Recipe,"[<span id=""recipenumvotes"">3482 ratings.</span>]"
Sattu Ka Paratha Recipe (Stuffed Channa Dal Flour Paratha),"[<span id=""recipenumvotes"">20408 ratings.</span>]"
Bajra Aloo Paratha Recipe,"[<span id=""recipenumvotes"">3081 ratings.</span>]"
Bharwa Karela With Sweet Potato Filling Recipe,"[<span id=""recipenumvotes"">1322 ratings.</span>]"
Subz Noor E Chashm Recipe (Nawabi Curry Recipe ),700
Kori Gassi Recipe - Mangalorean Traditional Chicken Curry With Coconut Milk,700
Tandoori Style Soya Chaap Curry Recipe,"[<span id=""recipenumvotes"">8247 ratings.</span>]"
Mirch Ki Sabzi Recipe With Roasted Peanuts,"[<span id=""recipenumvotes"">2137 ratings.</span>]"
Malwani Pumpkin And Raw Mango Curry Recipe,"[<span id=""recipenumvotes"">2369 ratings.</span>]"
Huli Soppu Saaru Recipe - Karnataka Style Mixed Greens Sambar,"[<span id=""recipenumvotes"">13554 ratings.</span>]"
Dry Palak Dal Sabzi Recipe,"[<span id=""recipenumvotes"">4164 ratings.</span>]"
Bengali Style Basanti Pulao Recipe,"[<span id=""recipenumvotes"">5166 ratings.</span>]"
Kollu Puli Kuzhambu Recipe - Horsegram In A Tangy Gravy,"[<span id=""recipenumvotes"">3177 ratings.</span>]"
Mughlai Style Chicken Haleem Recipe,"[<span id=""recipenumvotes"">4360 ratings.</span>]"
Bengali Style Kanch kolar Kofta Curry Recipe (Green Plantain Kofta Curry Recipe),"[<span id=""recipenumvotes"">9997 ratings.</span>]"
Kongunadu Style Senai Kilangu Masala Recipe - Yam in Spicy Gravy,"[<span id=""recipenumvotes"">1918 ratings.</span>]"
Goan Style French Beans Foogath Recipe,"[<span id=""recipenumvotes"">3568 ratings.</span>]"
Andhra Style Sorakaya Kura Recipe - Bottle Gourd And Toor Dal Recipe,"[<span id=""recipenumvotes"">2610 ratings.</span>]"
Mixed Sprouts In Chettinad Masala Recipe,"[<span id=""recipenumvotes"">1634 ratings.</span>]"
Besan Arbi Roast Recipe - Spicy Colocasia Stir Fry,"[<span id=""recipenumvotes"">1404 ratings.</span>]"
Stuffed Mooli Paneer Paratha Recipe,"[<span id=""recipenumvotes"">2248 ratings.</span>]"
Ullikadala Pulusu Recipe | Spring Onion Curry,"[<span id=""recipenumvotes"">2306 ratings.</span>]"
Vazhakkai Podimas Recipe (Ayurvedic Recipe With No Onion No Garlic),"[<span id=""recipenumvotes"">1523 ratings.</span>]"
Peanut Curry Recipe,"[<span id=""recipenumvotes"">2296 ratings.</span>]"
Matar Masala Tofu Recipe,"[<span id=""recipenumvotes"">1998 ratings.</span>]"
Bharwa Karela Masala Recipe,"[<span id=""recipenumvotes"">3465 ratings.</span>]"
Kathiyawadi Stuffed Onion Recipe,"[<span id=""recipenumvotes"">3107 ratings.</span>]"
Hyderabadi Bagare Tamatar (Spiced| Tossed Tomato Curry),"[<span id=""recipenumvotes"">1407 ratings.</span>]"
Classic Andhra Style Chicken Curry Recipe,"[<span id=""recipenumvotes"">27515 ratings.</span>]"
Chettinad Style Nattu Kozhi Varuval Recipe,"[<span id=""recipenumvotes"">16726 ratings.</span>]"
Mutton Keema Recipe,"[<span id=""recipenumvotes"">19517 ratings.</span>]"
Bendekaayi Gojju (Lady Finger In Coconut Curry) Recipe,"[<span id=""recipenumvotes"">2559 ratings.</span>]"
Petha Wadi Sabzi Recipe,"[<span id=""recipenumvotes"">834 ratings.</span>]"
Mixed Vegetable Akki Roti Recipe,"[<span id=""recipenumvotes"">1944 ratings.</span>]"
Spiced Turnips with Spinach Recipe,"[<span id=""recipenumvotes"">2866 ratings.</span>]"
Matar Aur Chilke Ka Sabzi (Peas & Peel Stir Fry Recipe),"[<span id=""recipenumvotes"">1513 ratings.</span>]"
Vankaya Pakodi Koora Recipe - Andhra Style Brinjal Pakora Curry,"[<span id=""recipenumvotes"">1729 ratings.</span>]"
Karnataka Style Sandige Huli Recipe (Toor dal dumplings in Gravy Recipe),"[<span id=""recipenumvotes"">4159 ratings.</span>]"
Gujarati Trevti Dal Recipe (Creamy Lentils Cooked In Mild Spices),"[<span id=""recipenumvotes"">6379 ratings.</span>]"
Methi Bajra Poori Recipe,"[<span id=""recipenumvotes"">3124 ratings.</span>]"
Hyderabadi Khatti Dal Recipe (Hyderabadi Tangy Lentil Curry),"[<span id=""recipenumvotes"">14743 ratings.</span>]"
Goan Raw Banana Sabzi Recipe,"[<span id=""recipenumvotes"">10952 ratings.</span>]"
Thekera Tenga Recipe,"[<span id=""recipenumvotes"">1964 ratings.</span>]"
Jhinga Gawar Recipe -Shrimps & Cluster Beans Sabzi,"[<span id=""recipenumvotes"">1198 ratings.</span>]"
Chana Turai/Nenua Chana Sabzi Recipe (Ridge Gourd with Black Chana Recipe),"[<span id=""recipenumvotes"">4492 ratings.</span>]"
Goat Curry In Yogurt Gravy Recipe,"[<span id=""recipenumvotes"">2095 ratings.</span>]"
Spicy Crab Masala Recipe,"[<span id=""recipenumvotes"">6704 ratings.</span>]"
Mangalorean Chana Gassi Recipe,"[<span id=""recipenumvotes"">1500 ratings.</span>]"
Beetroot & Sesame Thepla Recipe,"[<span id=""recipenumvotes"">3224 ratings.</span>]"
Murungai Keerai Thanni Saaru Recipe-Drumstick Leaves Soup,"[<span id=""recipenumvotes"">2125 ratings.</span>]"
Aloo Masala Puri Recipe,"[<span id=""recipenumvotes"">7455 ratings.</span>]"
Mushroom Thoran Recipe - Kerala Style Mushroom Sabzi,"[<span id=""recipenumvotes"">6254 ratings.</span>]"
Poosanikai Rasavangi Recipe - Ash Gourd Curry With Dal,"[<span id=""recipenumvotes"">2280 ratings.</span>]"
Dahi Bhindi Recipe - Okra in Yogurt Curry with Caramelized Onions,"[<span id=""recipenumvotes"">6058 ratings.</span>]"
Kottambari Tambuli Recipe - Udupi Style Raw Coriander Kadhi,"[<span id=""recipenumvotes"">1541 ratings.</span>]"
Doodh Jhinge Curry Recipe-Ridge Gourd Cooked In Milk,"[<span id=""recipenumvotes"">1384 ratings.</span>]"
Shahjahani Khichdi Recipe - Spiced Green Moong Dal Khichdi,"[<span id=""recipenumvotes"">3211 ratings.</span>]"
Assamese Narasingh Masor Jhol Recipe (Fish In Curry Leaves Gravy),"[<span id=""recipenumvotes"">1870 ratings.</span>]"
Maharashtrian Tomato Saar Recipe,"[<span id=""recipenumvotes"">25531 ratings.</span>]"
Goan Style Tonak Alsanyache Recipe (Black eyed beans cooked in Tonak Masala Recipe),"[<span id=""recipenumvotes"">2765 ratings.</span>]"
Hyderabadi Laziz Lamb Handi Recipe,"[<span id=""recipenumvotes"">2314 ratings.</span>]"
Marghi Na Farcha Recipe - Parsi Crispy Fried Chicken,"[<span id=""recipenumvotes"">2369 ratings.</span>]"
Carrot Methi Pachadi Recipe,"[<span id=""recipenumvotes"">1641 ratings.</span>]"
No Onion And No Garlic Aloo Gajar Matar Ki Sabzi Recipe,"[<span id=""recipenumvotes"">1985 ratings.</span>]"
Karnataka Special Huli Tovve Recipe,"[<span id=""recipenumvotes"">4269 ratings.</span>]"
Hariyali Chicken Tikka Recipe,"[<span id=""recipenumvotes"">48983 ratings.</span>]"
Padipe Saasmi Recipe - Udupi Style Amaranth Leaves Curry With Coconut & Tamarind,"[<span id=""recipenumvotes"">2344 ratings.</span>]"
Mixed Vegetable Koora Recipe - Mixed Vegetable Poriyal,"[<span id=""recipenumvotes"">2718 ratings.</span>]"
Hunase Gojju Recipe,"[<span id=""recipenumvotes"">5211 ratings.</span>]"
Nawabi Mixed Vegetable Gravy Recipe,"[<span id=""recipenumvotes"">5664 ratings.</span>]"
Rase Wale Aloo Recipe (Boiled Potato in Tangy Tomato Sauce),"[<span id=""recipenumvotes"">2243 ratings.</span>]"
Paneer Biryani Recipe,"[<span id=""recipenumvotes"">18211 ratings.</span>]"
Chettinad Pattani Kurma Recipe - Chettinad Peas Curry,"[<span id=""recipenumvotes"">10446 ratings.</span>]"
Bengali Aloo Jhinge Posto Curry Recipe (Potato and Ridge Gourd Curry),"[<span id=""recipenumvotes"">4397 ratings.</span>]"
Moringa Masoor Dal Recipe - Drumstick Leaves Dal,"[<span id=""recipenumvotes"">8396 ratings.</span>]"
Chettinad Vegetable Biryani Recipe,"[<span id=""recipenumvotes"">16975 ratings.</span>]"
Andhra Style Kandi Pachadi Recipe (Masoor Dal Chutney Recipe),"[<span id=""recipenumvotes"">4388 ratings.</span>]"
Goan Style Khatkhatem Recipe (Mixed Vegetable Gravy),"[<span id=""recipenumvotes"">1169 ratings.</span>]"
Ukad Recipe - Maharashtrian Rice Flour Porridge,"[<span id=""recipenumvotes"">5865 ratings.</span>]"
Pakistani Bhuna Gosht Recipe,"[<span id=""recipenumvotes"">35009 ratings.</span>]"
Pumpkin Sabzi Recipe with Panch Phoron Masala,"[<span id=""recipenumvotes"">1652 ratings.</span>]"
Chettinad Beans & Cauliflower Poriyal Recipe (South Indian Stir Fry),"[<span id=""recipenumvotes"">6405 ratings.</span>]"
Besan Burji Recipe-Chickpea Flour Scramble Recipe,"[<span id=""recipenumvotes"">2643 ratings.</span>]"
Whole Wheat Soya Keema Kulchas,"[<span id=""recipenumvotes"">963 ratings.</span>]"
Broccoli Paneer And Peanut Masala Recipe,"[<span id=""recipenumvotes"">3161 ratings.</span>]"
Kela Matar ki Sabzi Recipe - Raw Banana Green Peas Stir Fry,"[<span id=""recipenumvotes"">2323 ratings.</span>]"
Kerala Cherupayar Curry Recipe (Green Moong and Yellow Moong Dal Recipe),"[<span id=""recipenumvotes"">37534 ratings.</span>]"
Savory Shrimps On Skillet Recipe,"[<span id=""recipenumvotes"">554 ratings.</span>]"
Matar Butter Masala Recipe,"[<span id=""recipenumvotes"">1509 ratings.</span>]"
Rajma Kofta In Milk And Poppy Seed Gravy Recipe,"[<span id=""recipenumvotes"">690 ratings.</span>]"
Karnataka Style Avarekalu Chitranna Recipe (Field Beans Tossed With Lemon Rice),"[<span id=""recipenumvotes"">1298 ratings.</span>]"
Kurkuri Bhindi And Onion Masala Recipe,"[<span id=""recipenumvotes"">1481 ratings.</span>]"
Amlechi Uddamethi Recipe - Goan Raw Mango Curry,"[<span id=""recipenumvotes"">5539 ratings.</span>]"
Karnataka Style Huggi (Rice and Moong dal Savory Porridge),"[<span id=""recipenumvotes"">4774 ratings.</span>]"
Drumstick Leaves Ragi Roti Recipe - Moringa Millet Flat Bread,"[<span id=""recipenumvotes"">4373 ratings.</span>]"
Mooga Gathi (Sprouted Moong In Coconut Paste) Recipe,"[<span id=""recipenumvotes"">7146 ratings.</span>]"
Mysore Style Avarekalu Rasam Recipe,"[<span id=""recipenumvotes"">5829 ratings.</span>]"
Nargisi Kofta Curry Recipe - Spicy Scotched Egg Curry,"[<span id=""recipenumvotes"">13147 ratings.</span>]"
Niramish Shobji Chapor Jhol - Bengali Style Vegetable Curry with Lentil Patties,"[<span id=""recipenumvotes"">2322 ratings.</span>]"
Chapor Ghonto Recipe - Bengali Mix Vegetable With Lentils Patties,"[<span id=""recipenumvotes"">2957 ratings.</span>]"
Punjabi Bhindi Kadhi Recipe - Roasted Okra In Yogurt Curry,"[<span id=""recipenumvotes"">8403 ratings.</span>]"
Babru Recipe (Himachali Black Gram Stuffed Bread),"[<span id=""recipenumvotes"">3685 ratings.</span>]"
Arabian Chicken Mandi Recipe -Yemeni Style Rice & Chicken,"[<span id=""recipenumvotes"">100010 ratings.</span>]"
Mangalore Cucumber Chana Dal Subzi Recipe,"[<span id=""recipenumvotes"">1430 ratings.</span>]"
Rajasthani Laal Maas Recipe-Mutton In Red Spicy Gravy,"[<span id=""recipenumvotes"">31482 ratings.</span>]"
Sorakkai Paruppu Kuzhambu Recipe - Tamil Nadu Style Lauki Curry,"[<span id=""recipenumvotes"">6782 ratings.</span>]"
Bathua Raita Recipe,"[<span id=""recipenumvotes"">2974 ratings.</span>]"
Vegan Kofta Curry Recipe,"[<span id=""recipenumvotes"">1991 ratings.</span>]"
Maharashtrian Kakdi Thalipeeth Recipe - Spiced Cucumber Flat Bread,"[<span id=""recipenumvotes"">9935 ratings.</span>]"
Mangalorean Manoli Bheeja Upkari Recipe - Ivy Gourd & Cashew Sabzi,"[<span id=""recipenumvotes"">2932 ratings.</span>]"
Cauliflower And Red Bell Pepper Stir Fry Recipe,"[<span id=""recipenumvotes"">1542 ratings.</span>]"
Manathakkali Thayir Pachadi Recipe,"[<span id=""recipenumvotes"">815 ratings.</span>]"
Aloo Konir Dom Recipe (Assamese Egg & Potato Curry),"[<span id=""recipenumvotes"">4033 ratings.</span>]"
Chettinad Vengaya Kosu Recipe (Spicy Curry from Chettinad Cuisine),"[<span id=""recipenumvotes"">4285 ratings.</span>]"
Mini Bajra Uttapam Recipe,"[<span id=""recipenumvotes"">3703 ratings.</span>]"
Andhra Style Pindi Miriyam Recipe,"[<span id=""recipenumvotes"">2827 ratings.</span>]"
Broccoli Egg Bhurji Recipe,"[<span id=""recipenumvotes"">7264 ratings.</span>]"
Paneer Butter Masala Recipe,"[<span id=""recipenumvotes"">9630 ratings.</span>]"
Pineapple Gojju Recipe (Karnataka Style Tangy And Spicy Pineapple Curry),"[<span id=""recipenumvotes"">13313 ratings.</span>]"